proyecto_ley,titulo,estado,fecha_presentacion,proponente,autores,search_term,sumilla,comisiones,url_detalle
05584/2022-CR,LEY QUE ESTABLECE LAS UNIONES CIVILES ENTRE PAREJAS DEL MISMO SEXO,EN COMISIÓN,2023-07-17T00:00:00.000-0500,Congreso,"Moyano Delgado, Martha Lupe; Morante Figari, Jorge Alberto; Guerra García Campos, Hernando; Olivos Martínez, Vivian; Alegría García, Arturo; Lizarzaburu Lizarzaburu, Juan Carlos Martin",parejas del mismo sexo,PROPONE ESTABLECER LAS UNIONES CIVILES ENTRE PAREJAS DEL MISMO SEXO.,"['Constitución y Reglamento', 'Justicia y Derechos Humanos']",https://wb2server.congreso.gob.pe/spley-portal/#/expediente/main/2021/5584
05819/2023-CR,LEY DE MATRIMONIO IGUALITARIO,EN COMISIÓN,2023-09-04T00:00:00.000-0500,Congreso,"Paredes Piqué, Susel Ana María; Bazán Narro, Sigrid Tesoro; Cortez Aguirre, Isabel; Reymundo Mercado, Edgard Cornelio; Sánchez Palomino, Roberto Helbert; Kamiche Morante, Luis Roberto; Luque Ibarra, Ruth",matrimonio igualitario,PROPONE MODIFICAR EL ARTÍCULO 234 DEL CÓDIGO CIVIL.,"['Constitución y Reglamento', 'Justicia y Derechos Humanos']",https://wb2server.congreso.gob.pe/spley-portal/#/expediente/main/2021/5819
00525/2021-CR,Ley de Matrimonio Igualitario,EN COMISIÓN,2021-10-22T00:00:00.000-0500,Congreso,"Luque Ibarra, Ruth; Reymundo Mercado, Edgard Cornelio; Cortez Aguirre, Isabel; Bazán Narro, Sigrid Tesoro; Málaga Trillo, George Edward; Pablo Medina, Flor Aidee; Paredes Piqué, Susel Ana María; Alcarraz Agüero, Yorel Kira",matrimonio igualitario,Propone modificar el artículo 234 del Código Civil.,['Justicia y Derechos Humanos'],https://wb2server.congreso.gob.pe/spley-portal/#/expediente/main/2021/525
12171/2025-CR,"PROYECTO DE LEY QUE DECLARA ZONA INTANGIBLE LAS CABECERAS DE CUENCAS HIDROGRÁFICAS PERTENECIENTES A LIRIOPAMPA DE LA PROVINCIA DE HUALGAYOC Y RAMOSCUCHO DE LA PROVINCIA DE CELENDÍN
",EN COMISIÓN,2025-08-21T00:00:00.000-0500,Congreso,"Echeverría Rodríguez, Hamlet; Sánchez Palomino, Roberto Helbert; Limachi Quispe, Nieves Esmeralda; Coayla Juárez, Jorge Samuel; Bermejo Rojas, Guillermo; Varas Meléndez, Elías Marcial",gay,"PROPONE DECLARAR ZONA INTANGIBLE LAS CABECERAS DE CUENCAS HIDROGRÁFICAS PERTENECIENTES AL CASERÍO DE LIRIOPAMPA, DEL CENTRO POBLADO DE HUANGAMARCA, DISTRITO DE BAMBAMARCA, PROVINCIA DE HUALGAYOC, Y AL CENTRO POBLADO RAMOSCUCHO, DEL DISTRITO DE LA LIBERTAD DE PALLAN, PROVINCIA DE CELENDÍN; QUEDANDO PROHIBIDO DENTRO DE DICHA ZONA REALIZARSE TODA ACTIVIDAD DE EXPLORACIÓN Y EXPLOTACIÓN MINERA, GARANTIZANDO UN DESARROLLO SOSTENIBLE CON LA CONSERVACIÓN Y PROTECCIÓN DE LOS ECOSISTEMAS QUE ALBERGA, QUEBRADAS, RÍOS, LAGUNAS Y MANANTIALES
",['Agraria'],https://wb2server.congreso.gob.pe/spley-portal/#/expediente/main/2021/12171
12032/2025-CR,"PROYECTO DE LEY QUE DECLARA DE INTERÉS NACIONAL Y NECESIDAD PÚBLICA LA CREACIÓN DE LA UNIVERSIDAD NACIONAL AUTÓNOMA DE BAMBAMARCA (UNAB)

",EN COMISIÓN,2025-08-05T00:00:00.000-0500,Congreso,"Echeverría Rodríguez, Hamlet; Cutipa Ccama, Víctor Raúl; Coayla Juárez, Jorge Samuel; Bermejo Rojas, Guillermo; Limachi Quispe, Nieves Esmeralda; Varas Meléndez, Elías Marcial",gay,"PROPONE  DECLARAR DE INTERÉS NACIONAL Y NECESIDAD PÚBLICA LA CREACIÓN DE LA UNIVERSIDAD NACIONAL AUTÓNOMA DE BAMBAMARCA (UNAB), DE LA PROVINCIA DE HUALGAYOC, DEL DEPARTAMENTO DE CAJAMARCA.","['Educación, Juventud y Deporte']",https://wb2server.congreso.gob.pe/spley-portal/#/expediente/main/2021/12032
09993/2024-CR,"LEY QUE DECLARA DE NECESIDAD PÚBLICA E INTERÉS NACIONAL LOS ESTUDIOS Y CONSTRUCCIÓN DEL PROYECTO DE IRRIGACIÓN CORDILLERA VERDE, EN LAS PROVINCIAS CARHUAZ, YUNGAY Y HUAYLAS, DEPARTAMENTO DE ANCASH
",EN COMISIÓN,2025-01-20T00:00:00.000-0500,Congreso,"Portalatino Ávalos, Kelly Roxana; Cruz Mamani, Flavio; Agüero Gutiérrez, María Antonieta; Gonza Castillo, Américo; Mita Alanoca, Isaac; Cerrón Rojas, Waldemar José; Taipe Coronado, María Elizabeth",gay,"PROPONE DECLARAR DE NECESIDAD PÚBLICA E INTERÉS NACIONAL, LA REALIZACIÓN DE LOS ESTUDIOS TÉCNICOS Y CONSTRUCCIÓN DEL PROYECTO DE IRRIGACIÓN CORDILLERA VERDE EN LAS PROVINCIAS DE CARHUAZ, YUNGAY Y HUAYLAS",['Agraria'],https://wb2server.congreso.gob.pe/spley-portal/#/expediente/main/2021/9993
09414/2024-CR,LEY QUE DECLARA DE INTERÉS NACIONAL LOS PROYECTOS DE FORESTACIÓN Y REFORESTACIÓN EN LA CORDILLERA NEGRA DEL DEPARTAMENTO ANCASH,Orden del Día,2024-11-05T00:00:00.000-0500,Congreso,"Portalatino Ávalos, Kelly Roxana; Cruz Mamani, Flavio; Cerrón Rojas, Waldemar José; Taipe Coronado, María Elizabeth; Agüero Gutiérrez, María Antonieta; Mita Alanoca, Isaac",gay,"PROPONE DECLARAR DE NECESIDAD PÚBLICA E INTERÉS NACIONAL LA FORESTACIÓN Y REFORESTACIÓN DE LA CORDILLERA NEGRA EN LAS PROVINCIAS DE RECUAY, HUARAZ, CARHUAZ, YUNGAY DEL DEPARTAMENTO DE ÁNCASH",['Agraria'],https://wb2server.congreso.gob.pe/spley-portal/#/expediente/main/2021/9414
08813/2024-CR,"LEY QUE DISPONE LA CONTINUIDAD DEL FUNCIONAMIENTO INMEDIATO DE LAS ESCUELAS DE EDUCACIÓN SUPERIOR TÉCNICO PROFESIONAL DE AMAZONAS, ANDAHUAYLAS, CAJAMARCA, PUCALLPA, YUNGAY, HUANCAVELICA, MOQUEGUA, PASCO, TACNA, TUMBES, MAZAMARI Y SANTA LUCIA, PARA FORTALECER LA LUCHA FRONTAL CONTRA LA CRIMINALIDAD QUE VIENE AZOTANDO A LOS CIUDADANOS DE NUESTRO PAÍS Y GARANTIZAR LA SEGURIDAD CIUDADANA.",Publicada en el Diario Oficial El Peruano,2024-09-06T00:00:00.000-0500,Congreso,"Montalvo Cubas, Segundo Toribio; Cruz Mamani, Flavio; Agüero Gutiérrez, María Antonieta; Cerrón Rojas, Waldemar José; Mita Alanoca, Isaac; Portalatino Ávalos, Kelly Roxana",gay,"PROPONE AUTORIZAR LA CONTINUIDAD DE FUNCIONAMIENTO INMEDIATO DE LAS ESCUELAS DE EDUCACIÓN SUPERIOR TÉCNICO PROFESIONAL DE AMAZONAS, ANDAHUAYLAS, CAJAMARCA, PUCALLPA, YUNGAY, HUANCAVELICA, MOQUEGUA, PASCO, TACNA, TUMBES, MAZAMARI Y SANTA LUCIA PARA FORTALECER LA LUCHA FRONTAL CONTRA LA CRIMINALIDAD QUE VIENE AZOTANDO A LOS CIUDADANOS DE NUESTRO TERRITORIO NACIONAL.","['Defensa Nacional, Orden Interno, Desarrollo Alternativo y Lucha Contra las Drogas', 'Presupuesto y Cuenta General de la República']",https://wb2server.congreso.gob.pe/spley-portal/#/expediente/main/2021/8813
08103/2023-CR,"LEY QUE DECLARA DE NECESIDAD PÚBLICA E INTERÉS NACIONAL, LA CREACIÓN DE LA UNIVERSIDAD NACIONAL AUTÓNOMA DEL CALLEJÓN DE HUAYLAS, EN EL DISTRITO DE RANRAHIRCA, PROVINCIA DE YUNGAY DEL
DEPARTAMENTO DE ANCASH",DICTAMEN,2024-06-06T00:00:00.000-0500,Congreso,"Bellido Ugarte, Guido; Coayla Juárez, Jorge Samuel; Varas Meléndez, Elías Marcial",gay,"PROPONE DECLARAR DE NECESIDAD PÚBLICA E INTERÉS NACIONAL LA CREACIÓN E IMPLEMENTACIÓN DE LA UNIVERSIDAD NACIONAL AUTÓNOMA DEL CALLEJÓN DE HUAYLAS, CON PERSONERÍA JURÍDICA DE DERECHO PÚBLICO INTERNO, CON SEDE PRINCIPAL EN LA CIUDAD DE RANRAHIRCA, PROVINCIA DE YUNGAY DEL DEPARTAMENTO DE ANCASH.
","['Educación, Juventud y Deporte']",https://wb2server.congreso.gob.pe/spley-portal/#/expediente/main/2021/8103
06391/2023-CR,"LEY QUE DECLARA DE NECESIDAD PUBLICA Y DE INTERÉS NACIONAL, LA REHABILITACION Y MEJORAMIENTO DE LA CARRETERA EMP. ACCESO NUEVO PUENTE PALLAR — PUENTE CHAGUAL EN LOS DISTRITOS DE CHUGAY Y
COCHORCO, PROVINCIA DE SANCHEZ CARRION DEL DEPARTAMENTO DE LA LIBERTAD",DICTAMEN,2023-11-13T00:00:00.000-0500,Congreso,"Flores Ruiz, Víctor Seferino; Infantes Castañeda, Mery Eliana; Revilla Villanueva, César Manuel; Rospigliosi Capurro, Fernando Miguel; López Morales, Jeny Luz; Castillo Rivas, Eduardo Enrique",gay,"PROPONE DECLARAR DE NECESIDAD PÚBLICA Y DE INTERÉS NACIONAL, LA REHABILITACIÓN Y MEJORAMIENTO DE LA CARRETERA EMP. ACCESO NUEVO PUENTE PALLAR — PUENTE CHAGUAL EN LOS DISTRITOS DE CHUGAY Y
COCHORCO, PROVINCIA DE SÁNCHEZ CARRIÓN DEL DEPARTAMENTO DE LA LIBERTAD — (CUI 2543519), CON LA FINALIDAD DE IMPULSAR EL DESARROLLO ECONÓMICO Y SOCIAL DE LA POBLACIÓN.
",['Transportes y Comunicaciones'],https://wb2server.congreso.gob.pe/spley-portal/#/expediente/main/2021/6391
05323/2022-CR,"LEY QUE DECLARA DE INTERÉS NACIONAL EL MEJORAMIENTO Y CONSTRUCCIÓN DE LA CARRETERA NACIONAL PE10C, PUENTE PALLAR-PUENTE CHAGUAL EN LOS DISTRITOS DE CHUGAY Y COCHORCO DE LA PROVINCIA SÁNCHEZ CARRIÓN.",Publicada en el Diario Oficial El Peruano,2023-06-13T00:00:00.000-0500,Congreso,"Alva Rojas, Carlos Enrique",gay,"PROPONE DECLARAR DE INTERÉS NACIONAL EL MEJORAMIENTO Y CONSTRUCCIÓN DE LA CARRETERA NACIONAL PE10C, PUENTE PALLAR-PUENTE CHAGUAL EN LOS DISTRITOS DE CHUGAY Y COCHORCO DE LA PROVINCIA SÁNCHEZ CARRIÓN.",['Transportes y Comunicaciones'],https://wb2server.congreso.gob.pe/spley-portal/#/expediente/main/2021/5323
05148/2022-CR,"LEY QUE DECLARA DE NECESIDAD PÚBLICA E INTERÉS NACIONAL LA CULMINACIÓN DE LA OBRA DE LA CARRETERA LONGITUDINAL DE LA SIERRA (PE-3N), TRAMOS: COCHABAMBA — CHOTA; CHOTA-HUALGAYOC- DV. YANACOCHA Y COCHABAMBA-CUTERVO-CHIPLE EN EL DEPARTAMENTO DE CAJAMARCA.",Publicada en el Diario Oficial El Peruano,2023-05-23T00:00:00.000-0500,Congreso,"Quiroz Barboza, Segundo Teodomiro; Tello Montes, Nivardo Edgar; Medina Hermosilla, Elizabeth Sara; Paredes Gonzales, Alex Antonio; Gutiérrez Ticona, Paul Silvio; Vásquez Vela, Lucinda",gay,"PROPONE DECLARAR DE NECESIDAD PÚBLICA E INTERÉS NACIONAL LA CULMINACIÓN DE LA OBRA DE LA CARRETERA LONGITUDINAL DE LA SIERRA (PE-3N), TRAMOS: COCHABAMBA — CHOTA; CHOTA-HUALGAYOC- DV. YANACOCHA Y COCHABAMBA-CUTERVO-CHIPLE EN EL DEPARTAMENTO DE CAJAMARCA.",['Transportes y Comunicaciones'],https://wb2server.congreso.gob.pe/spley-portal/#/expediente/main/2021/5148
01777/2021-CR,"LEY QUE DECLARA INTANGIBLE, INALIENABLE E IMPRESCRIPTIBLE EL CAMPO SANTO DE YUNGAY",EN COMISIÓN,2022-04-21T00:00:00.000-0500,Congreso-Actualización,,gay,"PROPONE DECLARAR INTANGIBLE, INALIENABLE E IMPRESCRIPTIBLE EL CAMPO SANTO DE YUNGAY","['Descentralización, Regionalización, Gobiernos Locales y Modernización de la Gestión del Estado']",https://wb2server.congreso.gob.pe/spley-portal/#/expediente/main/2021/1777
01635/2021-CR,"LEY QUE DECLARA INTANGIBLE, INALIENABLE E IMPRESCRIPTIBLE EL “CAMPO SANTO DE YUNGAY”",EN COMISIÓN,2022-04-06T00:00:00.000-0500,Congreso,"Portalatino Ávalos, Kelly Roxana; Gonza Castillo, Américo; Quispe Mamani, Wilson Rusbel; Quito Sarmiento, Bernardo Jaime; Palacios Huamán, Margot; Taipe Coronado, María Elizabeth; Cerrón Rojas, Waldemar José",gay,"PROPONE DECLARAR INTANGIBLE, INALIENABLE E IMPRESCRIPTIBLE EL “CAMPO SANTO DE YUNGAY”.","['Descentralización, Regionalización, Gobiernos Locales y Modernización de la Gestión del Estado']",https://wb2server.congreso.gob.pe/spley-portal/#/expediente/main/2021/1635
01632/2021-CR,Ley que transfiere la propiedad del Fundo Santa Catalina y restituye la posesión y administración a favor de la municipalidad provincial de Yugay,EN COMISIÓN,2022-04-05T00:00:00.000-0500,Congreso,"Camones Soriano, Lady Mercedes; Julón Irigoín, Elva Edhit; Jáuregui Martínez de Aguayo, María de los Milagros Jackeline; Acuña Peralta, María Grimaneza; Acuña Peralta, Segundo Héctor; Soto Reyes, Alejandro; Salhuana Cavides, Eduardo; García Correa, Idelso Manuel",gay,Propone transferir la propiedad del Fundo Santa Catalina y restituye la posesión y administración a favor de la municipalidad provincial de Yugay.,"['Descentralización, Regionalización, Gobiernos Locales y Modernización de la Gestión del Estado']",https://wb2server.congreso.gob.pe/spley-portal/#/expediente/main/2021/1632
01615/2021-CR,"LEY QUE DECLARA INTANGIBLE, INALIENABLE E IMPRESCRIPTIBLE EL CAMPO SANTO DE YUNGAY",EN COMISIÓN,2022-04-04T00:00:00.000-0500,Congreso,"Varas Meléndez, Elías Marcial; Cruz Mamani, Flavio; Bellido Ugarte, Guido; Marticorena Mendoza, Jorge Alfonso; Cutipa Ccama, Víctor Raúl; Tello Montes, Nivardo Edgar; Gutiérrez Ticona, Paul Silvio",gay," PROPONE DECLARAR INTANGIBLE, INALIENABLE E IMPRESCRIPTIBLE EL CAMPO SANTO DE YUNGAY","['Descentralización, Regionalización, Gobiernos Locales y Modernización de la Gestión del Estado']",https://wb2server.congreso.gob.pe/spley-portal/#/expediente/main/2021/1615
00752/2021-CR,"LEY QUE DECLARA DE PREFERENTE INTERÉS NACIONAL Y DE NECESIDAD PÚBLICA LA CREACIÓN DEL DISTRITO DE SAN ANTONIO EN LA PROVINCIA DE HUALGAYOC, DEPARTAMENTO DE CAJAMARCA.",Publicada en el Diario Oficial El Peruano,2021-11-17T00:00:00.000-0500,Congreso-Actualización,,gay,"Propone declarar de preferente interés nacional y de necesidad pública la creación del distrito de San Antonio en la provincia de Hualgayoc, departamento de Cajamarca.","['Descentralización, Regionalización, Gobiernos Locales y Modernización de la Gestión del Estado']",https://wb2server.congreso.gob.pe/spley-portal/#/expediente/main/2021/752
04191/2022-CR,LEY QUE INCORPORA EL ARTÍCULO 323.A EN EL DECRETO LEGISLATIVO N° 635 QUE APRUEBA EL CÓDIGO PENAL PERUANO PARA FORTALECER LA PROTECCIÓN DE LAS PERSONAS CON DISCAPACIDAD Y LGTBIQ+ DE LA DISCRIMINACIÓN E INCITACIÓN A LA DISCRIMINACIÓN SEGUIDA DE VIOLENCIA,EN COMISIÓN,2023-02-07T00:00:00.000-0500,Congreso,"Kamiche Morante, Luis Roberto; Limachi Quispe, Nieves Esmeralda; Echeverría Rodríguez, Hamlet; Bermejo Rojas, Guillermo; Chávez Chino, Betssy Betzabet",LGTB,PROPONE INCORPORAR EL ARTÍCULO 323.A EN EL DECRETO LEGISLATIVO N° 635 QUE APRUEBA EL CÓDIGO PENAL PERUANO PARA FORTALECER LA PROTECCIÓN DE LAS PERSONAS CON DISCAPACIDAD Y LGTBIQ+ DE LA DISCRIMINACIÓN E INCITACIÓN A LA DISCRIMINACIÓN SEGUIDA DE VIOLENCIA.,"['Justicia y Derechos Humanos', 'Inclusión Social y Personas con Discapacidad']",https://wb2server.congreso.gob.pe/spley-portal/#/expediente/main/2021/4191
03575/2022-CR,LEY QUE FORTALECE LA PROTECCIÓN DE LOS DERECHOS DE LAS PERSONAS CON DISCAPACIDAD E INTEGRANTES DE LA POBLACIÓN LGTBIQ+ EN LOS CONTROLES DE IDENTIFICACIÓN POLICIAL Y CONTROLES POLICIALES PÚBLICOS REALIZADOS POR LA POLICÍA NACIONAL DEL PERÚ,DICTAMEN,2022-11-17T00:00:00.000-0500,Congreso,"Kamiche Morante, Luis Roberto; Limachi Quispe, Nieves Esmeralda; Echeverría Rodríguez, Hamlet; Chávez Chino, Betssy Betzabet; Bermejo Rojas, Guillermo",LGTB,PROPONE FORTALECER LA PROTECCIÓN DE LOS DERECHOS DE LAS PERSONAS CON DISCAPACIDAD E INTEGRANTES DE LA POBLACIÓN LGTBIQ+ EN LOS CONTROLES DE IDENTIFICACIÓN POLICIAL Y CONTROLES POLICIALES PÚBLICOS REALIZADOS POR LA POLICÍA NACIONAL DEL PERÚ.,['Justicia y Derechos Humanos'],https://wb2server.congreso.gob.pe/spley-portal/#/expediente/main/2021/3575
04191/2022-CR,LEY QUE INCORPORA EL ARTÍCULO 323.A EN EL DECRETO LEGISLATIVO N° 635 QUE APRUEBA EL CÓDIGO PENAL PERUANO PARA FORTALECER LA PROTECCIÓN DE LAS PERSONAS CON DISCAPACIDAD Y LGTBIQ+ DE LA DISCRIMINACIÓN E INCITACIÓN A LA DISCRIMINACIÓN SEGUIDA DE VIOLENCIA,EN COMISIÓN,2023-02-07T00:00:00.000-0500,Congreso,"Kamiche Morante, Luis Roberto; Limachi Quispe, Nieves Esmeralda; Echeverría Rodríguez, Hamlet; Bermejo Rojas, Guillermo; Chávez Chino, Betssy Betzabet",LGTBI,PROPONE INCORPORAR EL ARTÍCULO 323.A EN EL DECRETO LEGISLATIVO N° 635 QUE APRUEBA EL CÓDIGO PENAL PERUANO PARA FORTALECER LA PROTECCIÓN DE LAS PERSONAS CON DISCAPACIDAD Y LGTBIQ+ DE LA DISCRIMINACIÓN E INCITACIÓN A LA DISCRIMINACIÓN SEGUIDA DE VIOLENCIA.,"['Justicia y Derechos Humanos', 'Inclusión Social y Personas con Discapacidad']",https://wb2server.congreso.gob.pe/spley-portal/#/expediente/main/2021/4191
03575/2022-CR,LEY QUE FORTALECE LA PROTECCIÓN DE LOS DERECHOS DE LAS PERSONAS CON DISCAPACIDAD E INTEGRANTES DE LA POBLACIÓN LGTBIQ+ EN LOS CONTROLES DE IDENTIFICACIÓN POLICIAL Y CONTROLES POLICIALES PÚBLICOS REALIZADOS POR LA POLICÍA NACIONAL DEL PERÚ,DICTAMEN,2022-11-17T00:00:00.000-0500,Congreso,"Kamiche Morante, Luis Roberto; Limachi Quispe, Nieves Esmeralda; Echeverría Rodríguez, Hamlet; Chávez Chino, Betssy Betzabet; Bermejo Rojas, Guillermo",LGTBI,PROPONE FORTALECER LA PROTECCIÓN DE LOS DERECHOS DE LAS PERSONAS CON DISCAPACIDAD E INTEGRANTES DE LA POBLACIÓN LGTBIQ+ EN LOS CONTROLES DE IDENTIFICACIÓN POLICIAL Y CONTROLES POLICIALES PÚBLICOS REALIZADOS POR LA POLICÍA NACIONAL DEL PERÚ.,['Justicia y Derechos Humanos'],https://wb2server.congreso.gob.pe/spley-portal/#/expediente/main/2021/3575
05896/2023-CR,"LEY QUE PROHÍBE LOS ESFUERZOS QUE PRETENDAN CAMBIAR LA ORIENTACIÓN SEXUAL, IDENTIDAD DE GÉNERO O EXPRESIÓN DE GÉNERO O ATENTEN CONTRA LA LIBRE AUTODETERMINACIÓN DE LAS PERSONAS",EN COMISIÓN,2023-09-12T00:00:00.000-0500,Congreso-Actualización,,identidad de género,"PROPONE ESTABLECER EL MARCO LEGAL QUE PROHÍBE LOS ESFUERZOS DE CAMBIO DE LA ORIENTACIÓN SEXUAL, IDENTIDAD DE GÉNERO O EXPRESIÓN DE GÉNERO EL EJERCICIO O ATENTEN CONTRA LA LIBRE AUTODETERMINACIÓN DE LAS PERSONAS; GARANTIZANDO EL EJERCICIO PLENO DEL DERECHO A LA SALUD MENTAL SIN DISCRIMINACIÓN POR RAZONES DE ORIGEN, RAZA, RELIGIÓN, SEXO, ORIENTACIÓN SEXUAL, IDENTIDAD DE GÉNERO, EXPRESIÓN DE GÉNERO, EDAD, DISCAPACIDAD, IDENTIDAD ÉTNICA Y CULTURAL, CONDICIÓN ECONÓMICA, O DE CUALQUIER OTRA ÍNDOLE, DE TODAS LAS PERSONAS Y COMUNIDADES QUE SE ENCUENTREN EN TERRITORIO PERUANO, CONFORME A LO DISPUESTO POR EL ARTÍCULO 7 DE LA CONSTITUCIÓN POLÍTICA.
","['Justicia y Derechos Humanos', 'Salud y Población']",https://wb2server.congreso.gob.pe/spley-portal/#/expediente/main/2021/5896
02194/2021-CR,LEY DE IDENTIDAD DE GÉNERO,EN COMISIÓN,2022-05-30T00:00:00.000-0500,Congreso-Actualización,,identidad de género,Propone Ley de Identidad de Género.,['Constitución y Reglamento'],https://wb2server.congreso.gob.pe/spley-portal/#/expediente/main/2021/2194
02194/2021-CR,LEY DE IDENTIDAD DE GÉNERO,EN COMISIÓN,2022-05-30T00:00:00.000-0500,Congreso-Actualización,,ley de identidad de género,Propone Ley de Identidad de Género.,['Constitución y Reglamento'],https://wb2server.congreso.gob.pe/spley-portal/#/expediente/main/2021/2194
05584/2022-CR,LEY QUE ESTABLECE LAS UNIONES CIVILES ENTRE PAREJAS DEL MISMO SEXO,EN COMISIÓN,2023-07-17T00:00:00.000-0500,Congreso,"Moyano Delgado, Martha Lupe; Morante Figari, Jorge Alberto; Guerra García Campos, Hernando; Olivos Martínez, Vivian; Alegría García, Arturo; Lizarzaburu Lizarzaburu, Juan Carlos Martin",del mismo sexo,PROPONE ESTABLECER LAS UNIONES CIVILES ENTRE PAREJAS DEL MISMO SEXO.,"['Constitución y Reglamento', 'Justicia y Derechos Humanos']",https://wb2server.congreso.gob.pe/spley-portal/#/expediente/main/2021/5584
05896/2023-CR,"LEY QUE PROHÍBE LOS ESFUERZOS QUE PRETENDAN CAMBIAR LA ORIENTACIÓN SEXUAL, IDENTIDAD DE GÉNERO O EXPRESIÓN DE GÉNERO O ATENTEN CONTRA LA LIBRE AUTODETERMINACIÓN DE LAS PERSONAS",EN COMISIÓN,2023-09-12T00:00:00.000-0500,Congreso-Actualización,,orientación sexual,"PROPONE ESTABLECER EL MARCO LEGAL QUE PROHÍBE LOS ESFUERZOS DE CAMBIO DE LA ORIENTACIÓN SEXUAL, IDENTIDAD DE GÉNERO O EXPRESIÓN DE GÉNERO EL EJERCICIO O ATENTEN CONTRA LA LIBRE AUTODETERMINACIÓN DE LAS PERSONAS; GARANTIZANDO EL EJERCICIO PLENO DEL DERECHO A LA SALUD MENTAL SIN DISCRIMINACIÓN POR RAZONES DE ORIGEN, RAZA, RELIGIÓN, SEXO, ORIENTACIÓN SEXUAL, IDENTIDAD DE GÉNERO, EXPRESIÓN DE GÉNERO, EDAD, DISCAPACIDAD, IDENTIDAD ÉTNICA Y CULTURAL, CONDICIÓN ECONÓMICA, O DE CUALQUIER OTRA ÍNDOLE, DE TODAS LAS PERSONAS Y COMUNIDADES QUE SE ENCUENTREN EN TERRITORIO PERUANO, CONFORME A LO DISPUESTO POR EL ARTÍCULO 7 DE LA CONSTITUCIÓN POLÍTICA.
","['Justicia y Derechos Humanos', 'Salud y Población']",https://wb2server.congreso.gob.pe/spley-portal/#/expediente/main/2021/5896
02803/2022-CR,LEY QUE ESTABLECE LA UNIÓN CIVIL,Orden del Día,2022-08-15T00:00:00.000-0500,Congreso,"Cavero Alva, Alejandro Enrique; Williams Zapata, José Daniel; Tudela Gutiérrez, Adriana Josefina; Yarrow Lumbreras, Norma Martina; Córdova Lobatón, María Jessica; Gonzales Delgado, Diana Carolina; Chirinos Venegas, Patricia Rosa; Bazán Calderón, Diego Alonso Fernando",unión civil,PROPONE ESTABLECER LA UNIÓN CIVIL.,['Justicia y Derechos Humanos'],https://wb2server.congreso.gob.pe/spley-portal/#/expediente/main/2021/2803
04228/2022-CR,LEY QUE SANCIONA LOS CRÍMENES DE ODIO,EN COMISIÓN,2023-02-10T00:00:00.000-0500,Congreso,"Paredes Piqué, Susel Ana María",crímenes de odio,"PROPONE MODIFICAR LOS ARTÍCULOS 46°, 108, 121 Y 122 DEL CÓDIGO PENAL.",['Justicia y Derechos Humanos'],https://wb2server.congreso.gob.pe/spley-portal/#/expediente/main/2021/4228
07467/2023-CR,"LEY QUE TIPIFICA LOS DELITOS DE ODIO EN EL DECRETO LEGISLATIVO N° 635, CÓDIGO PENAL",EN COMISIÓN,2024-04-04T00:00:00.000-0500,Congreso,"Gonza Castillo, Américo; Palacios Huamán, Margot; Portalatino Ávalos, Kelly Roxana; Agüero Gutiérrez, María Antonieta; Cerrón Rojas, Waldemar José; Cruz Mamani, Flavio; Taipe Coronado, María Elizabeth",delitos de odio,"PROPONE TIPIFICAR LOS DELITOS DE ODIO EN EL DECRETO LEGISLATIVO N° 635, CÓDIGO PENAL.
",['Justicia y Derechos Humanos'],https://wb2server.congreso.gob.pe/spley-portal/#/expediente/main/2021/7467
12352/2025-CR,"PROYECTO DE LEY QUE PROMUEVE LA APLICACIÓN DEL PRINCIPIO DE IGUALDAD Y NO DISCRIMINACIÓN EN LA REMUNERACIÓN ENTRE FISCALES PROVISIONALES Y FISCALES TITULARES.
",EN COMISIÓN,2025-09-09T00:00:00.000-0500,Congreso,"Coayla Juárez, Jorge Samuel; Sánchez Palomino, Roberto Helbert; Varas Meléndez, Elías Marcial; Ugarte Mamani, Jhakeline Katy; Tacuri Valdivia, Germán Adolfo; Quispe Mamani, Wilson Rusbel",no discriminación,"PROPONE LA APLICACIÓN DEL PRINCIPIO DE IGUALDAD Y NO DISCRIMINACIÓN EN LA REMUNERACIÓN ENTRE FISCALES PROVISIONALES Y FISCALES TITULARES DEL MINISTERIO PÚBLICO”. SE INCORPORA, EN LO PERTINENTE, EL MANDATO CONSTITUCIONAL DE IGUALDAD ANTE LA LEY Y LOS PRINCIPIOS LABORALES DE IGUALDAD DE OPORTUNIDADES E IGUALDAD SALARIAL. LA PRESENTE LEY TIENE POR OBJETO CUMPLIR CON EL PRINCIPIO DE IGUALDAD Y NO DISCRIMINACIÓN EN LA REMUNERACIÓN BÁSICA, LA BONIFICACIÓN POR FUNCIÓN FISCAL, EL INCREMENTO DE LA BONIFICACIÓN POR FUNCIÓN, LA BONIFICACIÓN ADICIONAL, LOS GASTOS OPERATIVOS Y DEMÁS BENEFICIOS CONEXOS; DISPONIÉNDOSE QUE LOS COMPONENTES APLICABLES A LOS FISCALES PROVISIONALES SE EQUIPAREN AL 100% RESPECTO DE LOS QUE PERCIBEN LOS FISCALES TITULARES DEL MISMO NIVEL.
","['Presupuesto y Cuenta General de la República', 'Justicia y Derechos Humanos']",https://wb2server.congreso.gob.pe/spley-portal/#/expediente/main/2021/12352
12337/2025-CR,PROYECTO DE LEY QUE PROMUEVE LA APLICACIÓN DEL PRINCIPIO DE IGUALDAD Y NO DISCRIMINACION EN LA REMUNERACIÓN ENTRE JUECES SUPERNUMERARIOS CON LOS JUECES TITULARES,EN COMISIÓN,2025-09-05T00:00:00.000-0500,Congreso,"Coayla Juárez, Jorge Samuel; Sánchez Palomino, Roberto Helbert; Echeverría Rodríguez, Hamlet; Varas Meléndez, Elías Marcial; Ugarte Mamani, Jhakeline Katy; Limachi Quispe, Nieves Esmeralda",no discriminación,"TITÚLESE EL PRESENTE CUERPO LEGAL COMO “LEY QUE PROMUEVE LA APLICACIÓN DEL PRINCIPIO DE IGUALDAD Y NO DISCRIMINACIÓN EN LA REMUNERACIÓN ENTRE JUECES SUPERNUMERARIOS Y JUECES TITULARES DEL PODER JUDICIAL”. SE INCORPORA, EN TODO LO PERTINENTE, EL MANDATO CONSTITUCIONAL DE IGUALDAD ANTE LA LEY Y LOS PRINCIPIOS LABORALES DE IGUALDAD DE OPORTUNIDADES E IGUALDAD SALARIAL","['Presupuesto y Cuenta General de la República', 'Justicia y Derechos Humanos']",https://wb2server.congreso.gob.pe/spley-portal/#/expediente/main/2021/12337
12028/2025-CR,"PROYECTO DE LEY QUE PROMUEVE LA EDUCACIÓN INCLUSIVA DE CALIDAD EN EL NIVEL UNIVERSITARIO EN EL PERÚ
",EN COMISIÓN,2025-08-05T00:00:00.000-0500,Congreso,"Acuña Peralta, María Grimaneza; Soto Reyes, Alejandro; Cordero Jon Tay, Luis Gustavo; Heidinger Ballesteros, Nelcy Lidia; García Correa, Idelso Manuel; Lizarzaburu Lizarzaburu, Juan Carlos Martin",no discriminación,"PROPONE  PROMOVER Y REGULAR LA EDUCACIÓN INCLUSIVA DE CALIDAD EN EL NIVEL UNIVERSITARIO EN EL PERÚ, GARANTIZANDO LA IGUALDAD DE OPORTUNIDADES Y CONDICIONES PARA EL ACCESO, PERMANENCIA, DESARROLLO ACADÉMICO, EGRESO Y EMPLEABILIDAD DE ESTUDIANTES CON DISCAPACIDAD, NECESIDADES EDUCATIVAS ESPECIALES ASOCIADAS A DISCAPACIDAD, Y OTRAS CONDICIONES DE VULNERABILIDAD QUE AFECTEN SU PARTICIPACIÓN PLENA EN EL SISTEMA UNIVERSITARIO, BAJO LOS PRINCIPIOS DE EQUIDAD, EXCELENCIA ACADÉMICA, ACCESIBILIDAD UNIVERSAL, NO DISCRIMINACIÓN Y PERTINENCIA.
","['Educación, Juventud y Deporte']",https://wb2server.congreso.gob.pe/spley-portal/#/expediente/main/2021/12028
09990/2024-CR,LEY QUE ESTABLECE EL ADELANTO DE LA COMPENSACIÓN POR TIEMPO DE SERVICIOS PARA LOS TRABAJADORES ADMINISTRATIVOS DEL DECRETO LEGISLATIVO 276,EN COMISIÓN,2025-01-20T00:00:00.000-0500,Congreso,"Dávila Atanacio, Pasión Neomías; Flores Ramírez, Alex Randu; Pariona Sinche, Alfredo; Robles Araujo, Silvana Emperatriz; Quito Sarmiento, Bernardo Jaime",no discriminación,"PROPONE ESTABLECER EL ADELANTO DE LA COMPENSACIÓN POR TIEMPO DE SERVICIOS (CTS) PARA LOS TRABAJADORES ADMINISTRATIVOS SUJETOS AL RÉGIMEN LABORAL DEL DECRETO LEGISLATIVO 276, CON LA FINALIDAD DE ATENDER NECESIDADES ECONÓMICAS URGENTES DERIVADAS DEL ACTUAL CONTEXTO ECONÓMICO, GARANTIZANDO EL PRINCIPIO DE IGUALDAD Y NO DISCRIMINACIÓN EN EL ACCESO A ESTE BENEFICIO SOCIAL","['Presupuesto y Cuenta General de la República', 'Trabajo y Seguridad Social']",https://wb2server.congreso.gob.pe/spley-portal/#/expediente/main/2021/9990
