proyecto_ley,titulo,estado,fecha_presentacion,proponente,autores,search_term,sumilla,comisiones,url_detalle
07795/2023-CR,LEY QUE HOMOLOGA LA REMUNERACIÓN DE LOS TRABAJADORES DEL SECTOR PÚBLICO PARA MATERIALIZAR EL PRINCIPIO DE IGUALDAD Y NO DISCRIMINACIÓN,EN COMISIÓN,2024-05-09T00:00:00.000-0500,Congreso,"Soto Palacios, Wilson; Vergara Mendoza, Elvis Hernán; López Ureña, Ilich Fredy; Espinoza Vargas, Jhaec Darwin; Flores Ancachi, Jorge Luis; Aragón Carreño, Luis Ángel",no discriminación,"PROPONE HOMOLOGAR LA REMUNERACIÓN DE LOS TRABAJADORES DEL ESTADO, PARA EVITAR LA DISCRIMINACIÓN SALARIAL, SIN IMPORTAR LA PERTENENCIA A LOS REGÍMENES LABORALES DEL DECRETO LEGISLATIVO 276, DECRETO LEGISLATIVO 728, DECRETO LEGISLATIVO 1057, O LA LEY 30057, CON LA FINALIDAD DE MATERIALIZAR EL DERECHO FUNDAMENTAL A LA IGUALDAD DE LA REMUNERACIÓN POR IGUAL TRABAJO.
",['Presupuesto y Cuenta General de la República'],https://wb2server.congreso.gob.pe/spley-portal/#/expediente/main/2021/7795
06861/2023-CR,LEY QUE ESTABLECE MEDIDAS PARA PROMOVER LA PROTECCIÓN A LOS TRABAJADORES CON CANCER FRENTE A DESPIDOS ARBITRARIOS,Publicada en el Diario Oficial El Peruano,2024-01-24T00:00:00.000-0500,Congreso,"Portero López, Hilda Marleny; Aragón Carreño, Luis Ángel; Vergara Mendoza, Elvis Hernán; Espinoza Vargas, Jhaec Darwin; Doroteo Carbajo, Raúl Felipe; Soto Palacios, Wilson",no discriminación,"PROPONE ESTABLECER MEDIDAS PARA PROMOVER LA PROTECCIÓN A LOS TRABAJADORES PÚBLICOS Y PRIVADOS CON DIAGNÓSTICO DE CÁNCER A TRAVÉS MEDIDAS CONTRA EL DESPIDO ARBITRARIO Y OTRAS QUE GARANTICEN LA NO DISCRIMINACIÓN, EL TRABAJO DIGNO Y EL CUMPLIMIENTO DE MEDIDAS LABORALES QUE LES PERMITAN REALIZAR EL TRATAMIENTO TERAPÉUTICO EN EL MARCO DEL RESPETO A SU DIGNIDAD.
",['Trabajo y Seguridad Social'],https://wb2server.congreso.gob.pe/spley-portal/#/expediente/main/2021/6861
06633/2023-CR,LEY QUE INCORPORA A LOS TRABAJADORES DEL PODER JUDICIAL BAJO EL RÉGIMEN LABORAL DEL DECRETO LEGISLATIVO N° 1057- CONTRATO ADMINISTRATIVO DE SERVICIOS — CAS AL RÉGIMEN LABORAL DEL DECRETO LEGISLATIVO N° 728,DICTAMEN,2023-12-12T00:00:00.000-0500,Congreso,"Camones Soriano, Lady Mercedes; Chiabra León, Roberto Enrique; García Correa, Idelso Manuel; Salhuana Cavides, Eduardo; Julón Irigoín, Elva Edhit; Ruíz Rodríguez, Magaly Rosmery; Acuña Peralta, María Grimaneza",no discriminación,"PROPONE INCORPORAR AL PERSONAL JURISDICCIONAL Y ADMINISTRATIVO, QUE LABORA EN EL PODER JUDICIAL A PLAZO INDETERMINADO, BAJO EL RÉGIMEN DEL DECRETO LEGISLATIVO N° 1057 - RÉGIMEN ESPECIAL DE CONTRATACIÓN ADMINISTRATIVA DE SERVICIOS (CAS), AL RÉGIMEN LABORAL DEL DECRETO LEGISLATIVO N° 728 - LEY DE PRODUCTIVIDAD Y COMPETITIVIDAD LABORAL, EN RECONOCIMIENTO AL DERECHO DE
IGUALDAD Y NO DISCRIMINACIÓN EN LAS LABORES QUE SE REALIZAN EN TODAS LAS SEDES DEL PODER JUDICIAL.
","['Presupuesto y Cuenta General de la República', 'Justicia y Derechos Humanos']",https://wb2server.congreso.gob.pe/spley-portal/#/expediente/main/2021/6633
06463/2023-CR,LEY DE GARANTÍA DEL DERECHO A LA PARTICIPACIÓN EN LAS UTILIDADES,EN COMISIÓN,2023-11-20T00:00:00.000-0500,Congreso,"Cortez Aguirre, Isabel; Bazán Narro, Sigrid Tesoro; Martínez Talavera, Pedro Edwin; Luque Ibarra, Ruth; Echeverría Rodríguez, Hamlet; Kamiche Morante, Luis Roberto; Sánchez Palomino, Roberto Helbert; Robles Araujo, Silvana Emperatriz; Palacios Huamán, Margot; Cutipa Ccama, Víctor Raúl",no discriminación,"LA PRESENTE LEY TIENE POR OBJETO GARANTIZAR EL DERECHO DE LOS TRABAJADORES A LA PARTICIPACIÓN EN LAS UTILIDADES EN CUMPLIMIENTO DE LOS PRINCIPIOS PROTECTORES, DE IGUALDAD Y NO DISCRIMINACIÓN Y DE PRIMACÍA DE LA REALIDAD. EN PARTICULAR, SE CUMPLA CON UNA APLICACIÓN ADECUADA DE ESTE DERECHO EN LOS CASOS DE GRUPO DE EMPRESAS O NUEVAS FORMAS DE ORGANIZACIÓN EMPRESARIAL; ASÍ COMO ACLARAR EL PORCENTAJE DE LA PARTICIPACIÓN DE LOS TRABAJADORES EN EL SECTOR HIDROCARBUROS. ","['Economía, Banca, Finanzas e Inteligencia Financiera', 'Trabajo y Seguridad Social']",https://wb2server.congreso.gob.pe/spley-portal/#/expediente/main/2021/6463
06136/2023-CR,LEY DE LA ECONOMÍA DIGITAL,EN COMISIÓN,2023-10-13T00:00:00.000-0500,Congreso,"Flores Ancachi, Jorge Luis; Soto Palacios, Wilson; Doroteo Carbajo, Raúl Felipe; Vergara Mendoza, Elvis Hernán; Espinoza Vargas, Jhaec Darwin; Aragón Carreño, Luis Ángel",no discriminación,"PROPONE ESTABLECER UN MARCO REGULATORIO PARA LA PRESTACIÓN DE SERVICIOS POR CANALES DIGITALES, GARANTIZANDO LOS PRINCIPIOS DE NO DISCRIMINACIÓN, NEUTRALIDAD, SEGURIDAD DIGITAL Y EQUIVALENCIA FUNCIONAL.
","['Defensa del Consumidor y Organismos Reguladores de los Servicios Públicos', 'Educación, Juventud y Deporte']",https://wb2server.congreso.gob.pe/spley-portal/#/expediente/main/2021/6136
05790/2023-CR,LEY DEL DERECHO AL OLVIDO ONCOLOGICO,Publicada en el Diario Oficial El Peruano,2023-08-31T00:00:00.000-0500,Congreso,"Heidinger Ballesteros, Nelcy Lidia; Chiabra León, Roberto Enrique; Salhuana Cavides, Eduardo; Soto Reyes, Alejandro; García Correa, Idelso Manuel; Trigozo Reátegui, Cheryl; Julón Irigoín, Elva Edhit",no discriminación,"PROPONE ESTABLECER EL DERECHO AL OLVIDO ONCOLÓGICO COMO UNA HERRAMIENTA LEGAL QUE GARANTICE LA IGUALDAD Y NO DISCRIMINACIÓN DE LAS PERSONAS QUE SUPERARON UNA ENFERMEDAD ONCOLÓGICA AL MOMENTO DE REINSERTARSE A LA VIDA SOCIAL Y ECONÓMICA.
","['Economía, Banca, Finanzas e Inteligencia Financiera', 'Salud y Población']",https://wb2server.congreso.gob.pe/spley-portal/#/expediente/main/2021/5790
05544/2022-CR,LEY DE NO DISCRIMINACIÓN A LOS DOCENTES UNIVERSITARIOS CON ESTUDIOS DE DOCTORADO VIRTUAL.,EN COMISIÓN,2023-07-11T00:00:00.000-0500,Congreso,"Ugarte Mamani, Jhakeline Katy",no discriminación,PROPONE LEY DE NO DISCRIMINACIÓN A LOS DOCENTES UNIVERSITARIOS CON ESTUDIOS DE DOCTORADO VIRTUAL.,"['Educación, Juventud y Deporte']",https://wb2server.congreso.gob.pe/spley-portal/#/expediente/main/2021/5544
04439/2022-CR,LEY QUE REGULA EL ORDEN DE PRELACIÓN DE LOS APELLIDOS,DICTAMEN,2023-03-09T00:00:00.000-0500,Congreso,"Calle Lobatón, Digna; Luna Gálvez, José León; Alcarraz Agüero, Yorel Kira; Zeballos Madariaga, Carlos Javier",no discriminación,"PROPONE REGULAR EL ORDEN DE PRELACIÓN DE LOS APELLIDOS MEDIANTE LA MODIFICACIÓN DEL ARTÍCULO 20 DEL DECRETO LEGISLATIVO 635, CÓDIGO CIVIL, A FIN DE GARANTIZAR EL DERECHO FUNDAMENTAL DE LA IGUALDAD Y NO DISCRIMINACIÓN POR RAZÓN DE SEXO.
",['Justicia y Derechos Humanos'],https://wb2server.congreso.gob.pe/spley-portal/#/expediente/main/2021/4439
